cluster,keywords
Exit-Oriented,"energy, carbon, platform, developer, technology, designed, intended, based, offers, sustainable, products, food, reduce, waste, data"
Mixed Bridge,"energy, carbon, developer, platform, designed, technology, intended, offers, sustainable, reduce, waste, systems, products, materials, company offers"
High-Risk Frontier,"energy, carbon, platform, technology, developer, designed, intended, sustainable, waste, offers, reduce, food, based, products, data"
Government-Led,"developer, designed, platform, waste, farm, data, sustainable, offers, company offers, storage, water, costs, intended, monitoring, alternative"
Deep Green,insufficient descriptions
